{
  "schema_version": "1.1",

  "dataset": {
    "id": "qinghe-chapter-1-v5",
    "title": "燕云十六声·第一章·神仙不渡 剧情数据（扩充版）",
    "game": "燕云十六声",
    "language": "zh-CN",
    "collected_at": "2026-06-08",
    "content_scope": "第一章·神仙不渡（清河区域）四篇主线剧情：又见新燕来、匹马映林嘶、菱花尘满、为谁归去。含序章回忆、清河暗线（田英）、支线奇遇扩展、势力背景补充。spoiler_level≥2 的内容仅对已完成全章的玩家可见。",
    "disclaimer": "本数据集为非官方整理的剧情资料，仅供剧情梳理参考，不代表官方设定。部分信息基于社区分析（含抖音、B站等平台讨论），已标注置信度。"
  },

  "chapters": [
    {
      "id": "chapter-qinghe",
      "slug": "qinghe",
      "title": "第一章·神仙不渡",
      "region": "清河",
      "sort_order": 0,
      "progress_key": "qinghe",
      "progress_rank": 10,
      "summary": "主角是养父江晏保护下长大的遗孤。遭黑衣人袭击夺走玉佩后，在周红线陪伴下踏上追寻真相之路。主角在清河学武、寻亲、回到神仙渡与养母寒香寻重逢，经历不羡仙大火后与侠客伊刀并肩救人，最终告别清河前往开封。明线为主角寻亲与成长，暗线为绣金楼追杀、田英抗辽与各方势力角力。",
      "source_ids": ["src-3dm-qinghe", "src-ali213-all", "src-toutiao-qinghe-full", "src-official-narrative-interview"]
    }
  ],

  "factions": [
    {
      "id": "xiu-jin-lou",
      "slug": "xiu-jin-lou",
      "name": "绣金楼",
      "faction_type": "暗势力",
      "summary": "南唐情报组织，实为唐哀帝李祚复兴大唐的工具。创始人李祚以爱妻柳青衣的绣金舞命名。掌握梦傀邪术，追杀寒香寻以获取契丹卧底名单、寻田英、找主角夺镇冠珏。",
      "spoiler_level": 2,
      "visible_after_progress": "current",
      "source_ids": ["src-17173-analysis", "src-toutiao-qinghe-full", "src-toutiao-lizuo"]
    },
    {
      "id": "shen-xian-du",
      "slug": "shen-xian-du",
      "name": "神仙渡",
      "faction_type": "据点",
      "summary": "寒香寻经营的渡口，核心场所为不羡仙酒馆。主角曾在此生活，是清河地区的重要据点。",
      "spoiler_level": 1,
      "visible_after_progress": "start",
      "source_ids": ["src-3dm-qinghe", "src-toutiao-qinghe-full"]
    },
    {
      "id": "wu-xiang-men",
      "slug": "wu-xiang-men",
      "name": "无相门",
      "faction_type": "神秘势力",
      "summary": "序章中出现的势力，无相皇为代表。在序章中与江晏交战，当时无相皇处于被控制状态。",
      "spoiler_level": 1,
      "visible_after_progress": "qinghe",
      "source_ids": ["src-17173-analysis"]
    },
    {
      "id": "tian-quan",
      "slug": "tian-quan",
      "name": "天泉",
      "faction_type": "门派",
      "summary": "武林门派之一，以陌刀为武器，肉盾防御型。江晏原为天泉弟子，后叛离。王清为第二十一代总把头。",
      "spoiler_level": 1,
      "visible_after_progress": "qinghe",
      "source_ids": ["src-3dm-qinghe", "src-toutiao-wangqing"]
    },
    {
      "id": "hou-jin",
      "slug": "hou-jin",
      "name": "后晋军队",
      "faction_type": "历史势力",
      "summary": "五代十国时期后晋王朝的军队。作品借用了开运三年（946）后晋与契丹交战、王清力战而亡及杜重威随后投降等史事，并加入主角身世与梦傀等虚构情节。",
      "spoiler_level": 0,
      "visible_after_progress": "start",
      "source_ids": ["src-17173-analysis"]
    },
    {
      "id": "xuan-jian",
      "slug": "xuan-jian",
      "name": "悬剑",
      "faction_type": "刺客组织",
      "summary": "后周世宗柴荣创办的刺客组织。田英为其神级刺客，一人北上契丹执行任务，寻回文津馆绝学《十相之书》。清河暗线的核心势力。",
      "spoiler_level": 2,
      "visible_after_progress": "current",
      "source_ids": ["src-17173-tianying", "src-17173-analysis", "src-toutiao-qinghe-full"]
    },
    {
      "id": "wen-jin-guan",
      "slug": "wen-jin-guan",
      "name": "文津馆",
      "faction_type": "学术组织",
      "summary": "藏书之所，田英曾在此求学。田英翻遍馆内藏书，每本只翻三页，得号田三页。后随魏先生离开文津馆。",
      "spoiler_level": 3,
      "visible_after_progress": "current",
      "source_ids": ["src-qieyou-tianying"]
    },
    {
      "id": "wu-mian-ren",
      "slug": "wu-mian-ren",
      "name": "无面人",
      "faction_type": "秘密组织",
      "summary": "为潜入契丹卧底而自愿换脸的志士。成功者潜伏敌营，失败者自囚地宫。寒香寻作为主治换脸手术，掌握卧底名单。",
      "spoiler_level": 3,
      "visible_after_progress": "current",
      "source_ids": ["src-toutiao-qinghe-full", "src-toutiao-main-story"]
    },
    {
      "id": "yan-bei-meng",
      "slug": "yan-bei-meng",
      "name": "燕北盟",
      "faction_type": "义军组织",
      "summary": "作品设定中，燕北盟是王清创建的抗辽义军组织。王清为盟主，收养了许多孤儿，江晏为其义子之一。中渡桥之战后燕北盟遭受重创。",
      "spoiler_level": 1,
      "visible_after_progress": "qinghe",
      "source_ids": ["src-toutiao-wangqing", "src-toutiao-main-story"]
    },
    {
      "id": "qing-xi",
      "slug": "qing-xi",
      "name": "青溪",
      "faction_type": "医道门派",
      "summary": "医道门派，水月先生为门主。孙不弃原为青溪弟子，后因研究毒术被逐出师门。",
      "spoiler_level": 3,
      "visible_after_progress": "current",
      "source_ids": ["src-toutiao-lizuo"]
    }
  ],

  "characters": [
    {
      "id": "protagonist",
      "slug": "protagonist",
      "name": "主角",
      "aliases": ["少东家", "外乡人"],
      "summary": "从小被养父江晏保护长大的遗孤，心里向往江湖生活。十六岁时遭黑衣人袭击，镇冠珏被夺。",
      "interpretation": "江晏不惜一切保护主角，暗示其身份极为特殊；身世之谜是贯穿全剧的核心悬念。",
      "identity_tags": ["遗孤", "江湖新人", "清河线"],
      "faction_id": null,
      "importance": 5,
      "spoiler_level": 0,
      "first_appear_chapter_id": "chapter-qinghe",
      "visible_after_progress": "start",
      "source_ids": ["src-3dm-qinghe", "src-ali213-all", "src-toutiao-main-story"]
    },
    {
      "id": "zhou-hongxian",
      "slug": "zhou-hongxian",
      "name": "周红线",
      "aliases": [],
      "summary": "竹林旧居附近的少女，性格活泼正义、刚烈嫉恶。陪伴主角走过清河四篇旅途。在不羡仙大火中为指引众人上山挂旗，中箭身亡。",
      "interpretation": "红线被玩家称为'清河区第一工具人'、'眼泪收割机'。她的牺牲是清河篇最大泪点，但部分玩家认为其牺牲对剧情推动有限。历史原型暗合五代十国战乱中无数无名少女的悲剧。",
      "identity_tags": ["青梅竹马", "引导者", "清河线", "牺牲者"],
      "faction_id": null,
      "importance": 5,
      "spoiler_level": 1,
      "first_appear_chapter_id": "chapter-qinghe",
      "visible_after_progress": "qinghe",
      "source_ids": ["src-3dm-qinghe", "src-ali213-all", "src-toutiao-hongxian"]
    },
    {
      "id": "jiang-yan",
      "slug": "jiang-yan",
      "name": "江晏",
      "aliases": ["江无浪", "江叔"],
      "summary": "主角的养父，王清的义子。十六年前携婴儿（主角）和镇冠珏从绣金楼出逃，隐姓埋名抚养主角。原为天泉弟子，后被诬陷'弑父夺玉'。三年前突然失踪，后蒙面归来夺走玉佩。",
      "interpretation": "江晏的行为暗示他知晓主角身世的重大秘密。三年后归来夺玉的真实动机是第一章最大悬念。被玩家评价为'最大的守护者'。",
      "identity_tags": ["养父", "高手", "通缉犯", "王清义子", "天泉弃徒"],
      "faction_id": null,
      "importance": 5,
      "spoiler_level": 2,
      "first_appear_chapter_id": "chapter-qinghe",
      "visible_after_progress": "qinghe",
      "source_ids": ["src-17173-analysis", "src-dailiantong-main", "src-toutiao-wangqing", "src-toutiao-main-story"],
      "review_note": "江晏原为天泉弟子，后与绣金楼有关联并从中出逃，当前为逃亡状态，无明确势力归属。多重归属写于summary中。"
    },
    {
      "id": "han-xiangxun",
      "slug": "han-xiangxun",
      "name": "寒香寻",
      "aliases": ["寒姨", "洛神", "寻心"],
      "summary": "神仙渡不羡仙酒馆的女老板，主角的养母。表面经营酒馆，实为无面人换脸手术的主治医师'洛神'。与褚清泉有过恋情，褚清泉战死后回到不羡仙。",
      "interpretation": "寒香寻的多重身份暗示清河故事暗流涌动。'洛神'身份和换脸手术是揭开清河暗线的关键。后期在方寸山以'寻心'身份出现。",
      "identity_tags": ["养母", "酒馆老板", "清河线", "洛神", "换脸医师"],
      "faction_id": "shen-xian-du",
      "importance": 5,
      "spoiler_level": 2,
      "first_appear_chapter_id": "chapter-qinghe",
      "visible_after_progress": "qinghe",
      "source_ids": ["src-3dm-qinghe", "src-17173-analysis", "src-toutiao-qinghe-full", "src-9game-luoshen"],
      "review_note": "别名'洛神'和'寻心'为隐藏身份，spoiler_level已调整。"
    },
    {
      "id": "yi-dao",
      "slug": "yi-dao",
      "name": "伊刀",
      "aliases": ["刀哥", "死人刀"],
      "summary": "西域大盗，被江湖人称作'死人刀'。前期对侠义不屑一顾，在与褚清泉结识后逐渐明白'侠'字的重量。第二篇末尾与主角邂逅，第四篇中与主角并肩作战。在不羡仙大火中为保护主角，点燃炸药与敌人同归于尽。",
      "interpretation": "伊刀被玩家评价为'很难有人过了清河剧情而不爱上刀哥'。从粗鲁大盗到舍身取义的侠客，完成了最动人的人物弧光。临终台词'你明明手中有剑，为什么没能救人'成为游戏经典。",
      "identity_tags": ["侠客", "同伴", "清河线", "西域大盗", "牺牲者"],
      "faction_id": null,
      "importance": 5,
      "spoiler_level": 1,
      "first_appear_chapter_id": "chapter-qinghe",
      "visible_after_progress": "qinghe",
      "source_ids": ["src-3dm-qinghe", "src-17173-analysis", "src-baike-yidao", "src-toutiao-art"]
    },
    {
      "id": "chen-zixi",
      "slug": "chen-zixi",
      "name": "陈子奚",
      "aliases": [],
      "summary": "与江晏同行的义士，在序章中护送婴儿（主角）逃离绣金楼。穷途末路中仍与江晏对饮，是江晏的知己。在逃亡途中为主角挡刀。",
      "interpretation": "陈子奚的行为奠定了故事'乱世忠义'的基调，为保护主角，身边人甘愿付出生命。",
      "identity_tags": ["义士", "书生", "清河线"],
      "faction_id": null,
      "importance": 4,
      "spoiler_level": 1,
      "first_appear_chapter_id": "chapter-qinghe",
      "visible_after_progress": "qinghe",
      "source_ids": ["src-17173-analysis", "src-dailiantong-main"]
    },
    {
      "id": "black-clothed-man",
      "slug": "black-clothed-man",
      "name": "黑衣人",
      "aliases": [],
      "summary": "在主角十六岁时突然袭击，目标不是主角性命而是玉佩（镇冠珏）。袭击后主角昏迷。",
      "interpretation": "黑衣人'不要命只要玉'的行为暗示镇冠珏比主角的命更重要，或黑衣人不忍伤害主角。",
      "identity_tags": ["袭击者", "清河线"],
      "faction_id": null,
      "importance": 3,
      "spoiler_level": 0,
      "first_appear_chapter_id": "chapter-qinghe",
      "visible_after_progress": "start",
      "source_ids": ["src-3dm-qinghe", "src-dailiantong-main"],
      "review_note": "黑衣人身份和所属势力在第一章中未揭露，faction_id设为null。"
    },
    {
      "id": "wuxiang-huang",
      "slug": "wuxiang-huang",
      "name": "无相皇",
      "aliases": [],
      "summary": "序章中与江晏交战的对手。当时处于被控制状态，江晏在绝境中领悟武学将其击败。实为柳青衣抚养长大的孤儿。",
      "interpretation": "无相皇被控制的状态暗示背后有更大的势力在操纵。",
      "identity_tags": ["敌对势力首领", "梦傀受害者"],
      "faction_id": "wu-xiang-men",
      "importance": 3,
      "spoiler_level": 2,
      "first_appear_chapter_id": "chapter-qinghe",
      "visible_after_progress": "qinghe",
      "source_ids": ["src-17173-analysis", "src-toutiao-lizuo"]
    },
    {
      "id": "qianye",
      "slug": "qianye",
      "name": "千夜",
      "aliases": [],
      "summary": "第四篇中在酒香塔内与主角交战的对手。主角将其击败后带同伴回到神仙渡。绣金楼派往清河的杀手之一。",
      "interpretation": "千夜是绣金楼追杀清河的行动执行者之一。",
      "identity_tags": ["敌对角色", "绣金楼杀手"],
      "faction_id": "xiu-jin-lou",
      "importance": 3,
      "spoiler_level": 1,
      "first_appear_chapter_id": "chapter-qinghe",
      "visible_after_progress": "qinghe",
      "source_ids": ["src-ali213-all", "src-toutiao-qinghe-full"]
    },
    {
      "id": "feng-jisheng",
      "slug": "feng-jisheng",
      "name": "冯继升",
      "aliases": [],
      "summary": "清河隐月山附近的射箭师。主角在北竹林与之比试射箭并获胜，习得射术奇术。",
      "interpretation": null,
      "identity_tags": ["射箭师"],
      "faction_id": null,
      "importance": 3,
      "spoiler_level": 0,
      "first_appear_chapter_id": "chapter-qinghe",
      "visible_after_progress": "qinghe",
      "source_ids": ["src-3dm-qinghe"]
    },
    {